<?xml version="1.0" encoding="utf-8" ?>
<friquency_pair xmlns:xsi="http://www.w3.org/2001/XMLSchema-instance" xsi:noNamespaceSchemaLocation = "languageXML.xsd">
  <pair character="о" frequency="0.0928"></pair>
  <pair character="а" frequency="0.0866"></pair>
  <pair character="е" frequency="0.081"></pair>
  <pair character="ё" frequency="0.081"></pair>
  <pair character="и" frequency="0.0745"></pair>
  <pair character="н" frequency="0.0635"></pair>
  <pair character="т" frequency="0.063"></pair>
  <pair character="р" frequency="0.0553"></pair>
  <pair character="с" frequency="0.0545"></pair>
  <pair character="л" frequency="0.0432"></pair>
  <pair character="в" frequency="0.0419"></pair>
  <pair character="к" frequency="0.0347"></pair>
  <pair character="п" frequency="0.0335"></pair>
  <pair character="м" frequency="0.0329"></pair>
  <pair character="у" frequency="0.029"></pair>
  <pair character="д" frequency="0.0256"></pair>
  <pair character="я" frequency="0.0222"></pair>
  <pair character="ы" frequency="0.0211"></pair>
  <pair character="ь" frequency="0.019"></pair>
  <pair character="з" frequency="0.0181"></pair>
  <pair character="б" frequency="0.0151"></pair>
  <pair character="г" frequency="0.0141"></pair>
  <pair character="й" frequency="0.0131"></pair>
  <pair character="ч" frequency="0.0127"></pair>
  <pair character="ю" frequency="0.0103"></pair>
  <pair character="х" frequency="0.0092"></pair>
  <pair character="ж" frequency="0.0078"></pair>
  <pair character="ш" frequency="0.0077"></pair>
  <pair character="ц" frequency="0.0052"></pair>
  <pair character="щ" frequency="0.0049"></pair>
  <pair character="ф" frequency="0.004"></pair>
  <pair character="э" frequency="0.0017"></pair>
  <pair character="ъ" frequency="0.0004"></pair>
</friquency_pair>
